{
  "runId": "run-20260428-001",
  "contractId": "2026-04-28-v110-execution-layer",
  "phase": "review",
  "agentType": "evaluator",
  "timestamp": 1745824800000,
  "content": {
    "issues": [
      {
        "level": "medium",
        "type": "missing-test",
        "file": "sessions/execution/",
        "message": "Execution 记录无验证脚本，建议增加 JSON Schema 验证工具",
        "suggestion": "添加 scripts/validate-execution-records.sh 验证记录格式"
      },
      {
        "level": "low",
        "type": "documentation",
        "file": "sessions/execution/README.md",
        "message": "README 缺少清理和归档策略说明",
        "suggestion": "补充 TTL 和归档策略到 README"
      }
    ],
    "gradingResult": [
      {
        "criterion": "目录结构完整，.gitkeep 保留空目录",
        "passed": true
      },
      {
        "criterion": "JSON Schema 可解析，包含 Phase 4 预埋字段",
        "passed": true
      },
      {
        "criterion": "active-tasks.md 支持 executionRunId 关联",
        "passed": true
      },
      {
        "criterion": "CLAUDE.md 包含 Execution 记录触发规则",
        "passed": true
      }
    ]
  },
  "result": "passed",
  "extractedForMemory": false
}
